<?xml version="1.0" encoding="UTF-8"?>
<!DOCTYPE orders SYSTEM "donhang.dtd">
<orders>
    <order id="O001" customer="Nguyễn Văn A" date="2025-03-02">
        <item id="P001" quantity="2" price="500000">
            <name>Điện thoại Samsung Galaxy</name>
            <description>Smartphone Android tầm trung</description>
        </item>
        <item id="P002" quantity="1" price="25000000">
            <name>Laptop Dell Inspiron</name>
            <description>Laptop văn phòng hiệu suất cao</description>
        </item>
        <total_amount>26000000</total_amount>
        <payment_method>Thẻ tín dụng</payment_method>
    </order>
    
    <order id="O002" customer="Trần Thị B" date="2025-03-03">
        <item id="P003" quantity="3" price="150000">
            <name>Tai nghe Bluetooth</name>
            <description>Tai nghe không dây chất lượng cao</description>
        </item>
        <item id="P004" quantity="1" price="800000">
            <name>Ổ cứng SSD 1TB</name>
            <description>Ổ cứng thể rắn tốc độ cao</description>
        </item>
        <item id="P005" quantity="2" price="200000">
            <name>Chuột gaming</name>
            <description>Chuột chơi game chuyên nghiệp</description>
        </item>
        <total_amount>1650000</total_amount>
        <payment_method>Chuyển khoản</payment_method>
    </order>
    
    <order id="O003" customer="Lê Hoàng C" date="2025-03-04">
        <item id="P006" quantity="1" price="12000000">
            <name>Máy ảnh Canon EOS</name>
            <description>Máy ảnh DSLR chuyên nghiệp</description>
        </item>
        <total_amount>12000000</total_amount>
        <payment_method>Tiền mặt</payment_method>
    </order>
</orders>
